{
  "schema_version": "1.0",
  "artifact_type": "grade-4-kit-details-evidence",
  "evidence_id": "grade-4-post-intake-kit-details-2026-07-27",
  "issue_ref": "#41",
  "issue_comment_url": "https://github.com/elvistudio/opiq-helper/issues/41#issuecomment-5093283851",
  "historical_intake_report": "evaluations/grade-4-source-intake.json",
  "records": [
    {
      "kit_id": "55",
      "kit_details_url": "https://www.opiq.ee/Kit/Details/55",
      "verified_on": "2026-07-27",
      "verification_method": "manual_kit_details_review",
      "verified_by": "astzhalkouski",
      "grade_scope": [
        4
      ],
      "exact_grade_4_confirmed": true,
      "subject": null,
      "language": null,
      "programme_or_support_role": "unknown",
      "publisher": null,
      "curriculum": null,
      "access_mode": null,
      "evidence_source": {
        "kind": "direct_opiq_kit_details_manual_review",
        "kit_details_url": "https://www.opiq.ee/Kit/Details/55",
        "project_provenance_url": "https://github.com/elvistudio/opiq-helper/issues/41#issuecomment-5093283851"
      },
      "evidence_limitations": [
        "The verification was performed after the immutable ZIP intake and is not evidence contained in those ZIP captures.",
        "No screenshot or structured Kit Details export is committed in this repository.",
        "Only explicitly supplied values are preserved; other metadata remains null or unknown."
      ],
      "verified_metadata": null
    },
    {
      "kit_id": "82",
      "kit_details_url": "https://www.opiq.ee/Kit/Details/82",
      "verified_on": "2026-07-27",
      "verification_method": "manual_kit_details_review",
      "verified_by": "astzhalkouski",
      "grade_scope": [
        4
      ],
      "exact_grade_4_confirmed": true,
      "subject": null,
      "language": null,
      "programme_or_support_role": "unknown",
      "publisher": null,
      "curriculum": null,
      "access_mode": null,
      "evidence_source": {
        "kind": "direct_opiq_kit_details_manual_review",
        "kit_details_url": "https://www.opiq.ee/Kit/Details/82",
        "project_provenance_url": "https://github.com/elvistudio/opiq-helper/issues/41#issuecomment-5093283851"
      },
      "evidence_limitations": [
        "The verification was performed after the immutable ZIP intake and is not evidence contained in those ZIP captures.",
        "No screenshot or structured Kit Details export is committed in this repository.",
        "Only explicitly supplied values are preserved; other metadata remains null or unknown."
      ],
      "verified_metadata": null
    },
    {
      "kit_id": "154",
      "kit_details_url": "https://www.opiq.ee/Kit/Details/154",
      "verified_on": "2026-07-27",
      "verification_method": "manual_kit_details_review",
      "verified_by": "astzhalkouski",
      "grade_scope": [
        4
      ],
      "exact_grade_4_confirmed": true,
      "subject": null,
      "language": null,
      "programme_or_support_role": "unknown",
      "publisher": null,
      "curriculum": null,
      "access_mode": null,
      "evidence_source": {
        "kind": "direct_opiq_kit_details_manual_review",
        "kit_details_url": "https://www.opiq.ee/Kit/Details/154",
        "project_provenance_url": "https://github.com/elvistudio/opiq-helper/issues/41#issuecomment-5093283851"
      },
      "evidence_limitations": [
        "The verification was performed after the immutable ZIP intake and is not evidence contained in those ZIP captures.",
        "No screenshot or structured Kit Details export is committed in this repository.",
        "Only explicitly supplied values are preserved; other metadata remains null or unknown."
      ],
      "verified_metadata": null
    },
    {
      "kit_id": "161",
      "kit_details_url": "https://www.opiq.ee/Kit/Details/161",
      "verified_on": "2026-07-27",
      "verification_method": "manual_kit_details_review",
      "verified_by": "astzhalkouski",
      "grade_scope": [
        4,
        5,
        6
      ],
      "exact_grade_4_confirmed": false,
      "subject": null,
      "language": null,
      "programme_or_support_role": "school_stage_ii_physical_education_support",
      "publisher": null,
      "curriculum": null,
      "access_mode": null,
      "evidence_source": {
        "kind": "direct_opiq_kit_details_manual_review",
        "kit_details_url": "https://www.opiq.ee/Kit/Details/161",
        "project_provenance_url": "https://github.com/elvistudio/opiq-helper/issues/41#issuecomment-5093283851"
      },
      "evidence_limitations": [
        "The verification was performed after the immutable ZIP intake and is not evidence contained in those ZIP captures.",
        "No screenshot or structured Kit Details export is committed in this repository.",
        "Only explicitly supplied values are preserved; other metadata remains null or unknown."
      ],
      "verified_metadata": null
    },
    {
      "kit_id": "200",
      "kit_details_url": "https://www.opiq.ee/Kit/Details/200",
      "verified_on": "2026-07-27",
      "verification_method": "manual_kit_details_review",
      "verified_by": "astzhalkouski",
      "grade_scope": [
        1,
        2,
        3,
        4
      ],
      "exact_grade_4_confirmed": false,
      "subject": null,
      "language": null,
      "programme_or_support_role": "shared_supplementary_arts_and_crafts",
      "publisher": null,
      "curriculum": null,
      "access_mode": null,
      "evidence_source": {
        "kind": "direct_opiq_kit_details_manual_review",
        "kit_details_url": "https://www.opiq.ee/Kit/Details/200",
        "project_provenance_url": "https://github.com/elvistudio/opiq-helper/issues/41#issuecomment-5093283851"
      },
      "evidence_limitations": [
        "The verification was performed after the immutable ZIP intake and is not evidence contained in those ZIP captures.",
        "No screenshot or structured Kit Details export is committed in this repository.",
        "Only explicitly supplied values are preserved; other metadata remains null or unknown."
      ],
      "verified_metadata": null
    },
    {
      "kit_id": "206",
      "kit_details_url": "https://www.opiq.ee/Kit/Details/206",
      "verified_on": "2026-07-27",
      "verification_method": "manual_kit_details_review",
      "verified_by": "astzhalkouski",
      "grade_scope": [
        4
      ],
      "exact_grade_4_confirmed": true,
      "subject": null,
      "language": null,
      "programme_or_support_role": "unknown",
      "publisher": null,
      "curriculum": null,
      "access_mode": null,
      "evidence_source": {
        "kind": "direct_opiq_kit_details_manual_review",
        "kit_details_url": "https://www.opiq.ee/Kit/Details/206",
        "project_provenance_url": "https://github.com/elvistudio/opiq-helper/issues/41#issuecomment-5093283851"
      },
      "evidence_limitations": [
        "The verification was performed after the immutable ZIP intake and is not evidence contained in those ZIP captures.",
        "No screenshot or structured Kit Details export is committed in this repository.",
        "Only explicitly supplied values are preserved; other metadata remains null or unknown."
      ],
      "verified_metadata": null
    },
    {
      "kit_id": "332",
      "kit_details_url": "https://www.opiq.ee/Kit/Details/332",
      "verified_on": "2026-07-27",
      "verification_method": "manual_kit_details_review",
      "verified_by": "astzhalkouski",
      "grade_scope": [
        4
      ],
      "exact_grade_4_confirmed": true,
      "subject": null,
      "language": null,
      "programme_or_support_role": "unknown",
      "publisher": null,
      "curriculum": null,
      "access_mode": null,
      "evidence_source": {
        "kind": "direct_opiq_kit_details_manual_review",
        "kit_details_url": "https://www.opiq.ee/Kit/Details/332",
        "project_provenance_url": "https://github.com/elvistudio/opiq-helper/issues/41#issuecomment-5093283851"
      },
      "evidence_limitations": [
        "The verification was performed after the immutable ZIP intake and is not evidence contained in those ZIP captures.",
        "No screenshot or structured Kit Details export is committed in this repository.",
        "Only explicitly supplied values are preserved; other metadata remains null or unknown."
      ],
      "verified_metadata": null
    },
    {
      "kit_id": "476",
      "kit_details_url": "https://www.opiq.ee/Kit/Details/476",
      "verified_on": "2026-07-27",
      "verification_method": "manual_kit_details_review",
      "verified_by": "astzhalkouski",
      "grade_scope": [
        4,
        5,
        6,
        7,
        8,
        9
      ],
      "exact_grade_4_confirmed": false,
      "subject": "Tehnoloogiaõpetus",
      "language": "et",
      "programme_or_support_role": "multi_grade_technology_instructional_support",
      "publisher": "Merkuur",
      "curriculum": "Riiklik õppekava 2011",
      "access_mode": "free",
      "evidence_source": {
        "kind": "direct_opiq_kit_details_manual_review",
        "kit_details_url": "https://www.opiq.ee/Kit/Details/476",
        "project_provenance_url": "https://github.com/elvistudio/opiq-helper/issues/41#issuecomment-5093283851"
      },
      "evidence_limitations": [
        "The verification was performed after the immutable ZIP intake and is not evidence contained in those ZIP captures.",
        "No screenshot or structured Kit Details export is committed in this repository.",
        "Only explicitly supplied values are preserved; other metadata remains null or unknown."
      ],
      "verified_metadata": {
        "title": "Arvjuhitavad seadmed (CNC)",
        "chapters": 23,
        "total_tasks": 1,
        "textbook_tasks": 1,
        "task_collection_tasks": 0,
        "authors": [
          "Snapmaker Technology Co., Ltd"
        ],